{
  "artifact_schema": {
    "description": "One distinguished point of the shared walk with its coefficients: a*P + b*Q = (x, y), low DP_BITS bits of x zero, 2y <= p. Exactly these four keys.",
    "example": {
      "a": "c7d474d02567",
      "b": "31f68b36f378d",
      "x": "166b721090000",
      "y": "720d2d13bd24"
    },
    "properties": {
      "a": {
        "description": "coefficient of P, in [0, n)",
        "type": "string"
      },
      "b": {
        "description": "coefficient of Q, in [0, n)",
        "type": "string"
      },
      "x": {
        "description": "x-coordinate, lowercase hex, no prefix, no leading zero; low DP_BITS bits zero",
        "type": "string"
      },
      "y": {
        "description": "y-coordinate, canonical: 2y <= p",
        "type": "string"
      }
    },
    "required": [
      "x",
      "y",
      "a",
      "b"
    ],
    "type": "object"
  },
  "created_at": "2026-09-10T00:00:00+00:00",
  "funder": "treasury",
  "goal": "GOAL-certicom-eccp131",
  "piecework": {
    "unit_price": 1000,
    "units": 281474976710656
  },
  "reward": 2600000000,
  "statement": "Contribute distinguished points to the shared Pollard rho search for Certicom's ECCp-131, the open instance of GOAL-certicom-eccp131. This objective pays for the search; objective-certicom-eccp131.json pays for the answer, and is not expected to settle any other way. Run the walk in examples/certicom-ecdlp/jobs/eccp131-rho.json (job id 6f4881b59a78bfd929a7bf87bd2d4ce3210066862e62418b8333c39ec855cf7c; negation map on, so points are folded to 2y <= p during the walk). Each walker runs about 2^44 steps -- hours on a GPU -- to a point whose low 44 bits of x are zero. Submit that point as exactly {\"x\", \"y\", \"a\", \"b\"} in lowercase hex with y canonical and a*P + b*Q = (x, y). Each novel accepted point pays unit_price from the pool until the pool is empty. Ask work_assignment for your unit range; any valid point is paid whichever index it came from. About two million points are expected before two trails collide, and the collision's holder computes k with `tools/rho_dp.py collide`. Stage 0 rewards are notional: the pool is unit_price times the expected number of points, and nothing more is claimed for it.",
  "verifier": {
    "checker": "examples/certicom-ecdlp/checkers/eccp131_rho_dp.py",
    "checker_sha256": "a729dc052fb2275895efe22639ab27e538930c78996f6a33119b0d3b56fbc36a",
    "entrypoint": "check",
    "kind": "certificate"
  }
}
