{
  "created_at": "2026-07-28T00:00:00+00:00",
  "funder": "treasury",
  "goal": "GOAL-collatz-extremes",
  "reward": 100000,
  "statement": "Exhibit an integer n in [1, 10^7) whose Collatz trajectory reaches 1 in at least 500 steps.",
  "verifier": {
    "checker": "examples/collatz/checkers/long_trajectory.py",
    "checker_sha256": "df78b43c279aa931b0ee481ca946cd5788eb7b28351d66f83e5a980a9cf91473",
    "entrypoint": "check",
    "kind": "certificate"
  }
}
